{
  "contract_version": "1",
  "character_id": "stern",
  "day_id": "day105",
  "release": "release-1-mvp",
  "verdict": "PROFILE_DOCUMENTED",
  "edits": [
    {
      "file": "narrative/canon/stern_character_canon.md",
      "change_type": "add",
      "summary": "Created a dedicated locked canon character profile file for Ms. Stern, detailing her sublimated dominant fetish backstory and role as a protective institutional shield."
    },
    {
      "file": "narrative/canon/voice_guides/stern_voice_guide.md",
      "change_type": "add",
      "summary": "Created a voice guide lock file for Ms. Stern defining procedural vocabulary and double-meaning Level 3 spice warnings."
    },
    {
      "file": "narrative/canon/characters_canon.md",
      "change_type": "refine",
      "summary": "Updated canon index to register Ms. Stern as a main character with dedicated file."
    }
  ],
  "carry_forward_traits": [
    "sublimated_dominance",
    "procedural_severity",
    "protective_shield"
  ],
  "routing": {
    "writers_room": true,
    "lead_narrative_editor": true,
    "victorian_consultant": true
  },
  "markdown_report_path": "narrative/pipeline/character_profile_reports/stern_forensic_psychology_report.md"
}
