{
  "contract_version": "1",
  "character_id": "gideon",
  "day_id": "day105",
  "release": "release-1-mvp",
  "verdict": "PROFILE_DOCUMENTED",
  "edits": [
    {
      "file": "main-game/canon/gideon_character_canon.md",
      "change_type": "add",
      "summary": "Created a dedicated locked canon character profile file for Sir Gideon Locke, specifying archetype, psychological profile, Level 3 spice backstory, and voice constraints."
    },
    {
      "file": "main-game/canon/characters_canon.md",
      "change_type": "refine",
      "summary": "Updated canon index to register gideon as a main character with dedicated file."
    }
  ],
  "carry_forward_traits": [
    "high_compression_silence",
    "sovereign_predator",
    "intellectual_vanity"
  ],
  "routing": {
    "writers_room": true,
    "lead_narrative_editor": true,
    "victorian_consultant": true
  },
  "markdown_report_path": "main-game/pipeline/character_profile_reports/gideon_forensic_psychology_report.md"
}
