{
  "contract_version": "1",
  "character_id": "vance",
  "day_id": "day105",
  "release": "release-1-mvp",
  "verdict": "PROFILE_DOCUMENTED",
  "edits": [
    {
      "file": "narrative/canon/vance_character_canon.md",
      "change_type": "add",
      "summary": "Created a dedicated locked canon character profile file for Vance, detailing her backstory of fallen respectability, fragile anger, and displacement of self-hatred."
    },
    {
      "file": "narrative/canon/characters_canon.md",
      "change_type": "refine",
      "summary": "Updated canon index to register Vance as a main character with dedicated file."
    }
  ],
  "carry_forward_traits": [
    "displaced_fury",
    "fragile_anger",
    "humiliated_companion"
  ],
  "routing": {
    "writers_room": true,
    "lead_narrative_editor": true,
    "victorian_consultant": true
  },
  "markdown_report_path": "narrative/pipeline/character_profile_reports/vance_forensic_psychology_report.md"
}
